{
  "schema_version": "continuation-state/v4",
  "task_id": "task-20260312-sync-004",
  "request_id": "req-20260312-sync-004",
  "updated_at": "2026-03-12T12:40:00Z",
  "goal": "完成 releases/v0.13.0 与上游 v0.13.0 patch set 的增量同步计划",
  "task_family": "upstream_sync",
  "execution_mode": "spec_plan_workflow",
  "analysis_depth": "full_spec_plan",
  "deliverable_contract": "spec_plan",
  "persistence_mode": "full_bundle",
  "current_stage": "spec_plan",
  "bundle_root": ".agents/tasks/task-20260312-sync-004",
  "canonical_source_files": [
    ".agents/tasks/task-20260312-sync-004/spec.md",
    ".agents/tasks/task-20260312-sync-004/plan.md",
    ".agents/tasks/task-20260312-sync-004/checklist.md",
    ".agents/tasks/task-20260312-sync-004/progress.md"
  ],
  "selected_atomics": [
    "incremental-sync-analysis",
    "sync-impact-auditor"
  ],
  "execution_order": [
    "wp-collect-delta",
    "wp-map-impacted-surfaces",
    "wp-define-validation-window"
  ],
  "completed_work_packages": [
    "wp-collect-delta"
  ],
  "pending_work_packages": [
    "wp-map-impacted-surfaces",
    "wp-define-validation-window"
  ],
  "success_criteria": [
    "变更范围收口",
    "受影响模块映射完成",
    "验证窗口明确"
  ],
  "stop_conditions": [
    "上游 delta 范围未收口",
    "受影响 surfaces 无法映射"
  ],
  "reroute_conditions": [
    "若发现核心矛盾是 feature 路线而不是同步方式，则转 design_analysis"
  ],
  "unresolved_risks": [
    "release delta 可能跨多个 worker/executor surface",
    "validation 成本可能超默认窗口"
  ],
  "open_questions": [
    "是否需要同步 release note 中的 graph mode 变化",
    "是否存在必须联动的 custom ops 变更"
  ],
  "latest_selector_plan_refs": [
    "runtime/plans/plan-collect-delta.json",
    "runtime/plans/plan-map-surfaces.json"
  ],
  "latest_atomic_card_refs": [
    "runtime/atomic-cards/card-collect-delta.json"
  ],
  "compacted_history_refs": [
    "runtime/history/compaction-20260312T123000Z.json"
  ],
  "session_budget_used": 6120,
  "last_flush_at": "2026-03-12T12:38:00Z",
  "notes": "文件 bundle 是唯一 source of truth；continuation_state 只用于续跑。"
}
